Layer;Ontology;Path;Concept;Stereotype;Generalizations;Definition;Example;Relations
CORE;SPO;SEON:Core Layer:SPO:Intended Software Process Definition:Intended Process Structure;Specific Intended Process;;SPO:Intended Process   ;Intended Process that is part of the General Intended Process of a Project or Organization, necessarily composed of at least two Intended Activities.; the Construction Process defined for a specific project, the Training Process defined for an organizational OO training.;3
DOMAIN;SDRO;SEON:Domain Layer:SDRO:Mental Aspects;Mental Software Design Component;;SDRO:Software Design Proposition   ;A Software Design Proposition describing parts, or components, of the software system being designed. It represents what the designer has in mind about how components of system should be implemented. Thus, these components have specific properties, play specific roles and are expected to exist in particular places in the software system. ; System modules, UI elements.  Adapted from [Guarino, N., & Melone, M. R. S. (2015)] ;2
FOUNDATIONAL;UFO;Foundational Layer:UFO:UFO-C;Unfulfilled;;;;;0
CORE;SysSwO;SEON:Core Layer:SysSwO:Sw Artifacts;Software Artifact;category;RSMO:Measurable Software-Related Entity   UFO:Object   ;Object intentionally made to serve a given purpose in the context of a software Project or Organization.; a document, a model, a library, an e-mail, a bug.;9
DOMAIN;SDRO;SEON:Domain Layer:SDRO:Physical Aspects;Software Design Component;;UFO:Role   SysSwO:Program   ;A Program that plays a specific role in a Software System, implementing a Mental Software Design Component.  Adapted from [Guarino, N., & Melone, M. R. S. (2015)];;4
DOMAIN;SPMO;SEON:Domain Layer:SPMO:Tracked Process;Tracked Process;;SPO:Performed Project Process   ;;;1
DOMAIN;RSRO;SEON:Domain Layer:RSRO;Requirements Stakeholder;role;SPO:Stakeholder   SPO:Person Stakeholder   ;Stakeholder that provides needs and expectations for the product.; users, operators, customers, suppliers.;8
DOMAIN;HCIDO;HCI-ON:Domain Layer:HCIDO:Design Specification;User Requirement Artifact;;RSRO:Requirement Artifact   ;Requirement Artifacts that describe User Requirements (e.g., user requirements written as user stories).;;2
FOUNDATIONAL;UFO;Foundational Layer:UFO:UFO-C;Proposition;;UFO:Abstract Particular   ;A Proposition is a sentence that is either true or false. The truth of a proposition is determined by its correspondence to the existence of an entity or fact in reality, the so-called truthmaker of a proposition.;;3
DOMAIN;DPO;SEON:Domain Layer:DPO;Data Definitions;subkind;SysSwO:Information Item   ;Information Item describing the high-level choices of how the software will manage data.;;2
FOUNDATIONAL;UFO;Foundational Layer:UFO:UFO-A:UFO-A Qualities;Quality Structure;;UFO:Set   UFO:Abstract Particular   ;;;6
DOMAIN;CPO;SEON:Domain Layer:CPO;Code Review;event;SPO:Performed Simple Activity   ;Simple Performed Activity executed for reviewing the software Code to identify errors and non-conformances.;;6
DOMAIN;SPMO;SEON:Domain Layer:SPMO:Estimated Process;Estimated Process;;SPMO:Duration Estimated Process   SPMO:Cost Estimated Process   SPO:Scheduled Process   SPO:Project Process   ;A Project Process with cost, duration and time estimated.;;1
FOUNDATIONAL;UFO;Foundational Layer:UFO:UFO-A;High Order Universal;;;;;0
CORE;SPO;SEON:Core Layer:SPO:Process Assets:Resources;Software Resource;role;SysSwO:Software Product   SPO:Resource   ;Software Product when used as Resource of some process activity.; the Eclipse IDE being used by the Coding activity.;1
DOMAIN;RSMO;SEON:Domain Layer:RSMO:Software Measurable Entities;Measurable Software-Related Entity;;COM:Measurable Entity   ;Measurable Entity related to software.; a software project,  a standard process.;2
CORE;SPO;SEON:Core Layer:SPO:Intended Software Process Definition:Intended Process Structure;Project Process;mode;SPO:Intended Process   ;Intended Process defined to be performed within a Project.; a project Requirement Process, a project Construction Process.;2
DOMAIN;HCIEO;HCI-ON:Domain Layer:HCIEO:Central View;HCI Quality Characteristic;;UFO:Quality   UFO:Measurable Quality Universal   COM:Measurable Element   ;Characteristic expected in an Interactive Computer System (in software or hardware constituents), e.g., usability (software), screen size of a smart watch (hardware), among others. It can refer to the whole Interactive Computer System or part of it (e.g., its User Interface an Input Equipment).; usability of a smart watch, communicability of an UI login. ;5
FOUNDATIONAL;UFO;Foundational Layer:UFO:UFO-C;Complex Closed Commitment;;UFO:Closed Commitment   ;;;2
DOMAIN;HCIEO;HCI-ON:Domain Layer:HCIEO:Central View;HCI Evaluation Method;;SPO:Procedure   ;A Procedure describing the actions to be performed by the HCI Evaluator to perform a HCI Evaluation.; heuristic evaluation, cognitive walkthroughs, standards inspection, pluralistic walkthroughs, usability test, consistency inspections, among others. ;5
DOMAIN;RSMO;SEON:Domain Layer:RSMO:Software Measurement Process;Measurement Planning Start;event;SPO:Performed Simple Activity   ;Activity for defining the Software Measurement Plan structure, its initial information (e.g., organization to which it was defined and elaboration date) and starting its elaboration. ;;2
DOMAIN;ROoST;SEON:Domain Layer:ROoST:Testing Artifacts;Test Case Expected Result;subkind;SysSwO:Information Item   ;The result expected from the execution of a test case.;;3
DOMAIN;RSMO;SEON:Domain Layer:RSMO:Software Measurement Process;Data Analysis;event;;Activity for analyzing the selected Measured Values and producing the Analysis Result Description that records the Analysis Result.;;2
DOMAIN;HCIDO;HCI-ON:Domain Layer:HCIDO:Design Specification;HCI Design Choice;;SDRO:Software Design Choice   ;A Software Design Choice that describes Mental HCI Design Choices. It is a physical representation of Mental HCI Design Choices, which can be used for communication and evaluation purposes (e.g., the fragment of a sketch showing the fields of a form arranged in two columns or a sentence written in a document describing the expected behavior after a form submission).;;4
DOMAIN;DPO;SEON:Domain Layer:DPO;Design Evaluation Document;subkind;SysSwO:Document   ;Document registering the issues identified in a Design Document evaluation.;;1
CORE;HCIO;HCI-ON:Core Layer:HCIO:HC Interaction;User Observable State;;SysSwO:Computing Resulting State   ;A situation (an Observable State) perceivable by Users, typically achieved as the result (output) of a Program Copy Execution, communicated or presented by an Output Equipment.; a message shown in the mobile phone screen informing the user that the captured fingerprint was not recognized, smart watch vibrating, sounds emitted by the mobile phone.;5
FOUNDATIONAL;UFO;Foundational Layer:UFO:UFO-B;Fact;;UFO:Situation   ;;;1
CORE;SysSwO;SEON:Core Layer:SysSwO:Hw Equipment;Hardware Equipment;kind;UFO:Object   ;DEFINIÇÃO NOVA: Physical Object used to process, transform, store, display or transmit information or data   DEFINIÇÃO ANTIGA: Physical Object used for running software programs or to support some related action.; Computer Dell I7, Laser Printer HP, Smartphone Galaxy 7, Router Linksys Wi-fi.;5
DOMAIN;RSMO;SEON:Domain Layer:RSMO:Software Measurement Process;Software Measurement Planning;event;SPO:Performed Composite Activity   COM:Measurement Planning   ;Activity for planning the software measurement, i.e., for determining the Software Measurement Goals to be monitored, the Information Needs to be considered, the Software-Related Measures to be collected to meet the Information Needs and the Operational Definition of Measure to be considered. ;;10
CORE;EO;SEON:Core Layer:EO;Project Team;subkind;EO:Team   SPO:Team Stakeholder   ;;;2
CORE;SPO;SEON:Core Layer:SPO:Software Process Execution:Performed Process;Performed Specific Process;event;SPO:Performed Process   ;Performed Process that is part of the General Performed Process of a Project or Organization, necessarily composed of at least two Performed Activities.; the Project Management Process performed in a specific project, the Portfolio Management Process performed in an organization.;2
FOUNDATIONAL;UFO;Foundational Layer:UFO:UFO-A;Concrete Particular;;UFO:Individual   ;;;0
DOMAIN;ROoST;SEON:Domain Layer:ROoST:Testing Environment;Test Hardware Resource;role;SPO:Hardware Resource   ;Hardware Resource that comprises the Testing Environment of a Project.;;2
DOMAIN;RRO;SEON:Domain Layer:RRO:Runtime Requirements;Target Program Copy Execution;;SysSwO:Program Copy Execution   ;A Target Program Copy Execution is the execution of a Loaded Target Program Copy. It brings about to an Execution State.;;2
CORE;SPO;SEON:Core Layer:SPO:Standard Software Process Definition:Standard Process Structure;Standard Process Definition Document;kind;UFO:Plan Description   ;Plan Description, recognized by an Organization, which describes a set of Standard Processes.; The whole available description of an organization processes.;2
FOUNDATIONAL;UFO;Foundational Layer:UFO:UFO-A;Abstract Particular;;UFO:Individual   ;;;0
DOMAIN;CMPO;SEON:Domain Layer:CMPO;Checkin;event;SPO:Performed Simple Activity   ;Activity for including new Versions of Configuration Items into a version control repository.;;5
FOUNDATIONAL;UFO;Foundational Layer:UFO:UFO-A;Moment Universal;;UFO:Endurant Universal   ;;;1
FOUNDATIONAL;UFO;Foundational Layer:UFO:UFO-A;Relation;;UFO:Universal   ;;;0
CORE;HCIO;HCI-ON:Core Layer:HCIO:Interactive Computer System;Complex Interactive Computer System;;HCIO:Interactive Computer System   ;Interactive Computer System composed of others Interactive Computer System; IoT in a smart home. ;1
FOUNDATIONAL;UFO;Foundational Layer:UFO:UFO-C;Fulfilled;;;;;0
DOMAIN;QAPO;SEON:Domain Layer:QAPO;Noncompliance Resolution;event;SPO:Performed Simple Activity   ;Activity for analyzing a noncompliance, planning and executing the applicable corrective actions to its resolution.;;2
FOUNDATIONAL;UFO;Foundational Layer:UFO:UFO-A:UFO-A Qualities;Measurement Quality Region;;UFO:Quality Region   ;;;1
CORE;SysSwO;SEON:Core Layer:SysSwO:Hw Equipment;Computer Machine;;SysSwO:Hardware Equipment   ;Hardware Equipment able to run programs, processing, transforming and storing data  _____________  Computer Machine is a hardware equipament able to run programs, processing, transforming and storing data and information.  Definição ANTIGA: Machine is a hardware equipament able to run programs.;;4
CORE;SysSwO;SEON:Core Layer:SysSwO:Program Execution;Software Function;;UFO:Function   ;Software Functions are functional dispositions that constitute the complex disposition Loaded Program Copy. Each Software Function is an instance of a Software Function Universal. When the software development process is accomplished correctly, the Software Functions that constitute the Loaded Program Copy are instances of the exact Software Function Universals described by the Program Specification and successfully implemented by the Program.;;2
CORE;SPO;SEON:Core Layer:SPO:Software Process Execution:Stakeholder Participation;Stakeholder Main Participation;event;SPO:Stakeholder Participation   ;The participation of a Stakeholder as the main responsible for a Performed Activity, playing an Organizational Role.; Mary acting as the Project Manager in a Project Control activity.;1
DOMAIN;ROoST;SEON:Domain Layer:ROoST:Testing Techniques;Testing Technique;subkind;SPO:Technique   ;Technique for designing test cases. It can be Black-box, White-box, Model-based or Mutation testing techniques, among others.;;3
DOMAIN;HCIDO;HCI-ON:Domain Layer:HCIDO:Design Specification;HCI Design Specification;;SDRO:Software Design Specification   ;A Software Design Specification that describes Mental HCI Design Specifications, encoding one or more HCI Design Choices (e.g., a hand-drawn sketch or a text document).;;4
DOMAIN;ROoST;SEON:Domain Layer:ROoST:Testing Techniques;Black-box Testing Technique;subkind;ROoST:Testing Technique   ;Testing technique that ignores the internal mechanism of a system or component and focuses solely on the outputs generated in response to selected inputs and execution conditions (adapted from ISO/IEC/IEEE 24765:2017 Systems and software engineering-Vocabulary);;0
DOMAIN;CMPO;SEON:Domain Layer:CMPO;Change Review;event;SPO:Performed Simple Activity   ;Activity for reviewing an accomplished change assuring that the modifications were made as planned.;;6
DOMAIN;RDPO;SEON:Domain Layer:RDPO;Requirements Agreement;subkind;SysSwO:Information Item   ;Information Item representing the agreement achieved by the Stakeholders, regarding the Requirements for the product.; the agreement on the requirements than can be contained in an e-mail or in a document section.;1
DOMAIN;RSMO;SEON:Domain Layer:RSMO:Software Measurement Process;Measurement Manager;role;SPO:Stakeholder   ;Role played by the Stakeholder in charge of Software Measurement Planning.; If John (a Person Stakeholder) was in charge of a software measurement planning, then he played the role of measurement manager. ;1
DOMAIN;RSMO;SEON:Domain Layer:RSMO:Software Measurement Process;Measurement Goals Establishment;event;SPO:Performed Simple Activity   ;Activity for establishing and recording the Software Measurement Goals to be included in the Software Measurement Plan. ;;2
FOUNDATIONAL;UFO;Foundational Layer:UFO:UFO-A;Mode Universal;;UFO:Intrisic Moment Universal   ;;;0
DOMAIN;RSMO;SEON:Domain Layer:RSMO:Software Measurement Planning;Software Goal;;UFO:Goal   ;Goal that expresses the intention for which software-related actions are planned and performed. Software Goals are based on Business Goals.; the software goal Improve software products quality could be defined based on the business goal Increase the client’s satisfaction degree. ;2
FOUNDATIONAL;UFO;Foundational Layer:UFO:UFO-C;Object Kind;;UFO:Kind   ;;;2
CORE;SPO;SEON:Core Layer:SPO:Process Assets:Procedures;Technique;kind;SPO:Procedure   ;Procedure that provides heuristics to perform an activity (but in a less rigid and detailed way than a method, since it does not prescribe a set of activities).; White-box testing, Pair programming.;0
DOMAIN;CMPO;SEON:Domain Layer:CMPO;Request Evaluation;event;SPO:Performed Simple Activity   ;Activity for evaluating the Change Request for a set of Configuration Items, authorizing or rejecting it.;;5
FOUNDATIONAL;UFO;Foundational Layer:UFO:UFO-A;Endurant Universal;;UFO:Universal   ;;;2
CORE;EO;SEON:Core Layer:EO:Human Resource Management;Employment Type;2ndOT;;;;3
FOUNDATIONAL;UFO;Foundational Layer:UFO:UFO-C;Action Universal;;UFO:Event Universal   ;;;4
CORE;SysSwO;SEON:Core Layer:SysSwO:Sw Artifacts;Sw Artifact Type;2ndOT;UFO:Object Kind   ;Object Kind which is the powertype of Artifact, classifying its specializations.; Document, Model, Software Product, Information Item, Software Item.;7
DOMAIN;RSMO;SEON:Domain Layer:RSMO:Software Measurement Process;Operational Definition of Measure Establishment;event;SPO:Performed Simple Activity   ;Activity for establishing the Operational Definitions of Measures for the identified Software-Related Measures. ;;2
DOMAIN;RRO;SEON:Domain Layer:RRO:Runtime Requirements;Adaptation Program Copy Execution;;RRO:RRT Program Copy Execution   ;An Adaptation Program Copy Execution is the execution of a Loaded Adaptation Program Copy. It uses Change Runtime Requirement Artifacts as resources to triggers changes in its Loaded Target Program Copy.;;3
FOUNDATIONAL;UFO;Foundational Layer:UFO:UFO-B;Complex Event;;UFO:Event (Perdurant)   ;Complex events are aggregations of at least two disjoint events. A Complex Event is existentially dependent on all its proper parts and, indirectly, to the objects these proper parts depend on.;;1
DOMAIN;HCIDO;HCI-ON:Domain Layer:HCIDO:Design Specification;Mental HCI Design Choice;;HCIDO:HCI Design Proposition   SDRO:Mental Software Design Choice   ;Mental Software Design Choices defining how the human-computer interaction should be implemented, including aspects related to the system’s appearance, the disposition of components in space and time and their expected behaviors in response to user actions.;;7
DOMAIN;RSMO;SEON:Domain Layer:RSMO:Software Measurement Process;Selection of Entity for Measurement;event;;Activity for selecting the Software-Related Measurable Entity to be measured in the Software Measurement Execution. The selected entity type must be the Software-Related Measurable Entity Type indicated in the Operational Definition of Measure defined in the selected Software Measurement Plan Item. ;;1
FOUNDATIONAL;UFO;Foundational Layer:UFO:UFO-B;Time Point;;UFO:Quale   ;;;6
CORE;SPO;SEON:Core Layer:SPO:Software Process Execution:Performed Process;Performed Activity;event;RSMO:Measurable Software-Related Entity   UFO:Action   ;Action performed, in a specific Time Interval, by a Stakeholder, potentially producing and consuming Artifacts, as part of a Specific Performed Process.; Requirement Elicitation, Component Design, Coding, Integration Test, Training Planning.;19
DOMAIN;CMPO;SEON:Domain Layer:CMPO;Communicated CR;phase;CMPO:Change Request (CR)   ;Change Request in the first phase, communicated.;;1
DOMAIN;ROoST;SEON:Domain Layer:ROoST:Testing Process;Integration Testing;event;ROoST:Level-based Testing   ;Level-based Testing focusing on larger components, ensuring that a collection of units functions as desired.;;0
CORE;EO;SEON:Core Layer:EO:Human Resource Management;Formal Organization Member Type;2ndOT;EO:Human Resource Role   ;;;3
DOMAIN;HCIDO;HCI-ON:Domain Layer:HCIDO:Design Object;Mental HCI Design Object;;HCIDO:HCI Design Proposition   SDRO:Mental Software Design Object   ;A Mental Software Design Object specified by a Mental HCI Design Specification that refers to an Interactive Software System being designed (i.e., what is expected to exist after the HCI design effort);;2
DOMAIN;RDPO;SEON:Domain Layer:RDPO;Requirements Development Process;event;SPO:Performed Specific Process   ;Specific Performed Process for establishing and developing the requirements for a system or software.;;4
CORE;COM;SEON:Core Layer:COM:Measure;Derived Measure;;COM:Measure   ;Measure used to quantify an Indirectly Measurable Element.; the measure body mass index in kilos and meters can be used to quantify the indirectly measurable element body mass index.;4
DOMAIN;CMPO;SEON:Domain Layer:CMPO;Change Requesting;event;SPO:Performed Simple Activity   ;Activity for requesting the modification of a set of Configuration Items.;;4
CORE;SysSwO;SEON:Core Layer:SysSwO:Sw Artifacts;Program;subkind;SysSwO:Software Item   ;Software Item which aims at producing a certain result through execution on a computer, in a particular way, given by the Program Specification. A Program is constituted by code, but it is not identical to code. Code can be changed without altering the identity of its program, which is anchored to the program's essential property: its intended specification (Program Specification).;;7
FOUNDATIONAL;UFO;Foundational Layer:UFO:UFO-C;Desire;;UFO:Mental Moment   ;;;0
CORE;HCIO;HCI-ON:Core Layer:HCIO:User;User Initiated Participation;;HCIO:User Participation   ;Event in which a User inputs data or information using an Input Equipment.; user touching her finger to unlock her mobile phone by using her fingerprint.;5
DOMAIN;QAPO;SEON:Domain Layer:QAPO;Noncompliance Responsible;role;SPO:Person Stakeholder   ;Stakeholder responsible for solving a noncompliance.;;1
CORE;HCIO;HCI-ON:Core Layer:HCIO:Interactive Computer System;Interactive Software System;;SysSwO:Software System   ;Software system that includes, among other programs, User Interface Programs.; a home banking system and its graphical programs that deals with user interface aspects.;2
CORE;SPO;SEON:Core Layer:SPO:Process Assets:Procedures;Simple Method Activity;2ndOT;SPO:Method Activity   UFO:Atomic Action Universal   ;Method Activity that is not further decomposed into other Method Activities.;;0
DOMAIN;CMPO;SEON:Domain Layer:CMPO;Configuration Items Identification;event;SPO:Performed Composite Activity   ;Activity for identifying the Configuration Items of a Project.;;1
DOMAIN;RRO;SEON:Domain Layer:RRO:Runtime Requirements;Runtime Requirement Artifact;;RSRO:Requirement Artifact   ;Runtime Requirement Artifact is a Requirement Artifact written in a computational file that could be processed by a program at runtime (RRT Program Copy Execution).;;2
DOMAIN;SDRO;SEON:Domain Layer:SDRO:Mental Aspects;Mental Computing Resulting State;;SDRO:Software Design Proposition   ;A Software Design Proposition that represents an expected result of a Mental Software Design Choice that can only be assessed in runtime. ;;2
FOUNDATIONAL;UFO;Foundational Layer:UFO:UFO-C;Belief;;UFO:Mental Moment   ;;;0
CORE;EO;SEON:Core Layer:EO;Team;kind;UFO:Social Agent   ;Social Agent representing a group of people with a defined purpose.; a Testing team, a Quality Assurance team, a Deployment team.;2
FOUNDATIONAL;UFO;Foundational Layer:UFO:UFO-C;Action;;UFO:Event (Perdurant)   ;Actions are intentional events, i.e. they are caused by Intentions. Actions are events which instantiate a Plan (Action Universal) with the specific purpose of satisfying (the propositional content of) some Intention.;;3
DOMAIN;CMPO;SEON:Domain Layer:CMPO;Configuration Management Planning;event;SPO:Performed Composite Activity   ;Activity for planning the Configuration Management Process, including, among others, the Configuration Management System Establishment and the Configuration Items Identification.;;6
CORE;SPO;SEON:Core Layer:SPO:Process Assets:Stakeholders;Person Stakeholder;role;SPO:Stakeholder   UFO:Person   ;Person interested or affected by the process activities or their results.; an Analyst, a Programmer, a User.;0
DOMAIN;DPO;SEON:Domain Layer:DPO;Design Documentation;event;SPO:Performed Composite Activity   ;Activity for registering the architectural and detailed design choices and decisions, producing a Design Document.;;4
FOUNDATIONAL;UFO;Foundational Layer:UFO:UFO-C;Function;;UFO:Disposition   ;;;1
CORE;HCIO;HCI-ON:Core Layer:HCIO:User;User Intention;;UFO:Intention   ;An Intention that inheres in a User, causing him to perform intentional user actions.; the intention to travel on vacation.  ;3
DOMAIN;RDPO;SEON:Domain Layer:RDPO;Requirements Elicitation;event;SPO:Performed Composite Activity   ;Composite Performed Activity executed for identifying requirements from the Stakeholders and other sources, and documenting them.;;4
FOUNDATIONAL;UFO;Foundational Layer:UFO:UFO-C;Agent;;UFO:Substantial   ;Agents are Substantials (Functional Complexes or Collectives) that can bear special kinds of Intrinsic Moments named Intentional Moments.;;4
CORE;SPO;SEON:Core Layer:SPO:Intended Software Process Definition:Intended Process Structure;Software Project;subkind;RSMO:Measurable Software-Related Entity   EO:Project   ;A Project related to software development or maintenance.;;8
DOMAIN;RSRO;SEON:Domain Layer:RSRO;Stakeholder Intention;;UFO:Intention   ;The intention of Requirements Stakeholders that defines requirements to be achieved.;;2
FOUNDATIONAL;UFO;Foundational Layer:UFO:UFO-A;Phasemixin;;UFO:Anti-Rigid Mixin Universal   ;;;0
DOMAIN;SDRO;SEON:Domain Layer:SDRO:Physical Aspects;Software Design Object;;SysSwO:Software System   ;A Software System which is the concrete realization of some Software Design Specification, implementing Mental Software Design Objects.;;4
DOMAIN;RDPO;SEON:Domain Layer:RDPO;Requirements Documentation;event;SPO:Performed Composite Activity   ;Composite Performed Activity executed for recording Documented Requirements and related Conceptual Models in Requirements Documents, assuring proper recording and management of them during and after the project.;;4
CORE;EO;SEON:Core Layer:EO;Team Membership;relator;UFO:Social Relator   ;;;3
CORE;SPO;SEON:Core Layer:SPO:Process Assets:Stakeholders;Project Stakeholder;rolemixin;SPO:Stakeholder   ;Stakeholder interested in a particular Project.; the Project Team, the Project Client.;1
FOUNDATIONAL;UFO;Foundational Layer:UFO:UFO-C;Social Moment;;UFO:Intentional Moment   UFO:Externally Dependent Moment   ;;;1
DOMAIN;CMPO;SEON:Domain Layer:CMPO;Checkout;event;SPO:Performed Simple Activity   ;Activity for accessing defined versions of Configuration Items from a version control repository, usually for changing purposes.;;3
FOUNDATIONAL;UFO;Foundational Layer:UFO:UFO-C;Function Universal;;;;;1
CORE;COM;SEON:Core Layer:COM:Measurement Planning;Information Need;;UFO:Goal   ;Information Needs are identified from Measurement Goals and determine which information have to be met by Measures in order to monitor the achievement of the related Measurement Goal.; the information need What is the patient body mass index? could be identified from the measurement goal Check if the patient has a good body mass index.;6
DOMAIN;RSMO;SEON:Domain Layer:RSMO:Software Measurement Planning;Measure Description;subkind;SysSwO:Information Item   ;Information Item that documents the description of  a Software-Related Measure.; the record of the software-related measure   delivered defects density.;3
FOUNDATIONAL;UFO;Foundational Layer:UFO:UFO-A;Abstract Thing;;;;;0
FOUNDATIONAL;UFO;Foundational Layer:UFO:UFO-A:UFO-A Qualities;Ordinal MeaRefDimension;;UFO:Measurement Reference Dimension   ;;;0
FOUNDATIONAL;UFO;Foundational Layer:UFO:UFO-A;Formal Relation;;UFO:Relation   ;;;0
DOMAIN;ROoST;SEON:Domain Layer:ROoST:Testing Artifacts;Test Suite;subkind;SysSwO:Document   ;A collection of test cases that are intended to be used to test a software program to show that it has some specified set of behaviours (Wikipedia).;;1
