Layer;Ontology;Path;Concept;Stereotype;Generalizations;Definition;Example;Relations
CORE;SPO;SEON:Core Layer:SPO:Process Assets:Procedures;Document Template;kind;SPO:Procedure   ;Procedure aiming to establish a uniform way for preparing a Document, providing a predefined format and a defined structure for filling with the expected information.; Project Plan Template, Test Report Template.;1
FOUNDATIONAL;UFO;Foundational Layer:UFO:UFO-B;Event Universal;;UFO:Universal   ;;;1
DOMAIN;RRO;SEON:Domain Layer:RRO:Runtime Requirements;Change Runtime Requirement Artifact;;RRO:Runtime Requirement Artifact   ;Change Runtime Requirement Artifact specifies changes on the system's behavior, in order for the software system to keep fulfilling the goals it has been designed for.;;2
DOMAIN;DPO;SEON:Domain Layer:DPO;Architectural Connector;subkind;DPO:Architectural Element   ;Architectural Element connecting two or more Components in an Architecture.;;1
DOMAIN;RRO;SEON:Domain Layer:RRO:Runtime Requirements;Loaded Target Program Copy;;SysSwO:Loaded Program Copy   ;Loaded Target Program Copy is the materialization of a Target Program.;;3
FOUNDATIONAL;UFO;Foundational Layer:UFO:UFO-C;Social Role;;UFO:Role   ;;;1
FOUNDATIONAL;UFO;Foundational Layer:UFO:UFO-C;Social Relator;;UFO:Relator   ;;;1
CORE;EO;SEON:Core Layer:EO;Organizational Role;2ndOT;UFO:Social Role   ;A Social Role, recognized by the Organization, assigned to Agents when they are hired, included in a team, allocated or participating in activities.; System Analyst, Designer, Programmer, Client Organization.;8
DOMAIN;QAPO;SEON:Domain Layer:QAPO;Evaluation Report;subkind;SysSwO:Document   ;Document describing the evaluation results and identified issues.;;1
DOMAIN;ROoST;SEON:Domain Layer:ROoST:Testing Techniques;Model-based Testing Technique;subkind;ROoST:Testing Technique   ;Testing technique in which the test cases are derived from a model that describes the system under test.;;0
CORE;HCIO;HCI-ON:Core Layer:HCIO:HC Interaction;User Input Resulting State;;UFO:Situation   ;A situation achieved as the result of User’s input (data or information) received by means of an Input Equipment.; the user fingerprint captured by the mobile phone system, the button clicked.;4
DOMAIN;CMPO;SEON:Domain Layer:CMPO;Deliverable Product;subkind;SysSwO:Software Product   ;Software Product ready to be delivered to the client.;;2
DOMAIN;RSMO;SEON:Domain Layer:RSMO:Software Measurement Process;Planning Item Documentation;event;SPO:Performed Simple Activity   ;Activity for documenting Measurement Planning Items. Each Measurement Planning Item includes a Software Measurement Goal Description, an Information Need Description, a Software-Related Measure and an Operational Definition of Measure. Measurement Planning Items produced during the Software Measurement Analysis are part of the Software Measurement Plan produced in that activity. ;;3
FOUNDATIONAL;UFO;Foundational Layer:UFO:UFO-A;Relational Role;;UFO:Role   ;;;0
CORE;SysSwO;SEON:Core Layer:SysSwO:Sw Artifacts;Document;kind;SysSwO:Software Artifact   ;Any written or pictorial, uniquely identified, information related to the software development, usually presented in a predefined format.; a Requirements Document, a specification, a report.;2
DOMAIN;ROoST;SEON:Domain Layer:ROoST:Testing Artifacts;Test Case;subkind;SysSwO:Document   ;Document containing the input data, expected results, steps and general conditions for testing some situation regarding a Code To Be Tested.;;10
DOMAIN;RSMO;SEON:Domain Layer:RSMO:Software Measurement Process;Analysis Result Description;;SysSwO:Information Item   ;Information Item that records the Analysis Result produced in a Software Measurement Analysis.  ; the record of the analysis result: the schedule performance index of the Project P has improved in the last three months and the project is now adherent to the agreed schedule.    ;4
CORE;SPO;SEON:Core Layer:SPO:Process Assets:Resources;CASE Tool;subkind;SysSwO:Software Product   ;;;0
CORE;SPO;SEON:Core Layer:SPO;Software Organization;;;;;1
DOMAIN;CMPO;SEON:Domain Layer:CMPO;Change Requester;role;SPO:Stakeholder   ;Stakeholder responsible for requesting a change in Configuration Items.;;1
DOMAIN;CMPO;SEON:Domain Layer:CMPO;Reviewed CR;phase;CMPO:Change Request (CR)   ;Change Request reviewed to check if the modifications done are correct.;;1
DOMAIN;QAPO;SEON:Domain Layer:QAPO;Quality Assurance Plan;subkind;SysSwO:Document   ;Document registering the planed quality assurance activities, processes and artifacts to be evaluated and involved personnel.;;1
CORE;HCIO;HCI-ON:Core Layer:HCIO:HC Interaction;Human-Computer Interaction;;UFO:Complex Action   COM:Measurable Entity   ;An exchange of information (i.e., communication) between a User and an Interactive Computer System via the User Interface.; user touching her finger to unlock her mobile phone by using her fingerprint and the mobile phone system showing a message informing that the fingerprint was not recognized, user entering a room, in a smart home, which automatically turns on the light. ;6
FOUNDATIONAL;UFO;Foundational Layer:UFO:UFO-A;Entity;;;Entity is the topmost category of UFO, representing anything, concrete or abstract, and both types and individuals.;;1
CORE;EO;SEON:Core Layer:EO:Organizational Structure;Formal Organization Type;2ndOT;;;;4
CORE;SysSwO;SEON:Core Layer:SysSwO:Sw Artifacts;Software Product;kind;SysSwO:Software Artifact   SysSwO:Complex Sw Artifact   ;One or more computer programs together with any accompanying auxiliary items, such as documentation, delivered under a single name, ready for use.; Astah modeling tool, Microsoft Word, Eclipse IDE.;3
CORE;SPO;SEON:Core Layer:SPO:Intended Software Process Definition:Allocation;Stakeholder Allocation;relator;UFO:Social Relator   ;Social Relator representing a Stakeholder allocated to perform a Scheduled Activity acting an Organizational Role.; the allocation of Mary as a Project Manager to perform the scheduled Project Planning activity.;4
DOMAIN;RSMO;SEON:Domain Layer:RSMO:Software Measurement Process;Selection of Data for Analysis;event;;Activity for selecting the Measured Values of the selected Software-Related Measures to be analyzed in the Software Measurement Analysis. ;;1
CORE;SysSwO;SEON:Core Layer:SysSwO:Sw Artifacts;Atomic Sw Artifact;category;SysSwO:Software Artifact   ;Artifact that is not decomposed into other Artifacts.;;0
DOMAIN;RSRO;SEON:Domain Layer:RSRO;Requirements Document;subkind;SysSwO:Document   SysSwO:Complex Sw Artifact   ;Document composed of Documented Requirements and related information, as a basis for other technical software processes, including maintenance.; the Requirements Document of the Alfa Project.;11
DOMAIN;DPO;SEON:Domain Layer:DPO;Design Process;event;SPO:Performed Specific Process   ;Process for defining and specifying a solution to be implemented for a software product, considering the requirements for it. It is a refinement process starting with the software architecture, and going down to the design of its elements, interfaces, and other characteristics of a software, until achieving the design of implementation units.;;4
CORE;COM;SEON:Core Layer:COM:Measurement Planning;Measurement Planning;;UFO:Event (Perdurant)   ;Action that plans the measurement, i.e., determines the Measurement Goals to be monitored, the Information Needs to be considered, the Measures to be collected to meet the Information Needs and the Measurement Procedures to be applied. ;;1
CORE;SysSwO;SEON:Core Layer:SysSwO:Program Execution;Computing Resulting State;;UFO:Situation   ;Observable State is a situation resulting from the execution of a program copy. It involves qualities and quality values (qualia) of the Machine in which the Loaded Program Copy inheres, as well as of entities residing in that Machine (including the Loaded Program Copy itself).;;4
DOMAIN;RSMO;SEON:Domain Layer:RSMO:Software Measurement Process;Selection of Measurement Goals for Analysis;event;;Activity for selecting the Software Measurement Goal to be monitored by using information provided by the Software Measurement Analysis.   ;;1
CORE;SPO;SEON:Core Layer:SPO:Intended Software Process Definition:Intended Process Structure;Composite Intended Activity;mode;SPO:Intended Activity   ;Intended Activity composed of other Intended Activities.;;2
FOUNDATIONAL;UFO;Foundational Layer:UFO:UFO-C;Goal;;UFO:Proposition   ;The propositional content of an Intention.;;4
DOMAIN;DPO;SEON:Domain Layer:DPO;Component Design;event;SPO:Performed Simple Activity   ;Activity for refining each Architectural Component of a software.;;2
DOMAIN;SPMO;SEON:Domain Layer:SPMO:Estimated Process;Estimated Stakeholder Allocation;;SPO:Stakeholder Allocation   ;;;2
CORE;HCIO;HCI-ON:Core Layer:HCIO:Interactive Computer System;User Interface;;UFO:Object   COM:Measurable Entity   ;All components of an interactive system (software or hardware) that provide information and controls for the user to accomplish specific tasks with the interactive system.; mouse, keyboard, monitor, sensors and the software that handle them. ;13
CORE;COM;SEON:Core Layer:COM:Measurement;Measured Value;;COM:Scale Value   ;Value obtained in a Measurement.; the measured value 75 obtained in the measurement of the measurable element weight of the measurable entity John by applying the measure weight in kilos.;4
DOMAIN;ROoST;SEON:Domain Layer:ROoST:Testing Artifacts;Code To Be Tested;role;SysSwO:Code   ;Portion of Code (software module) to be tested by a Test Case.;;2
CORE;COM;SEON:Core Layer:COM:Measure;Interval Scale;;COM:Scale   UFO:Interval MeaRefDimension   ;Scale in which it is possible to quantify the distance between its Scale Values and there is not a value to represent nonentity (absolute zero). In an Interval Scale, although it is possible to quantify the distance between Scale Values, it is not possible to establish other relations between them.; the measure temperature in Celsius degree has an interval scale, since it is possible to quantify the distance between its scale values (e.g., there are 10o between the temperatures 20oC and 30oC), 0oC does not mean the absence of temperature and it is not possible to establish relations between scale values (e.g., we cannot say that 50oC is twice hotter than 25oC).;0
CORE;SPO;SEON:Core Layer:SPO:Intended Software Process Definition:Intended Process Structure;General Project Process;;SPO:Project Process   ;;;1
DOMAIN;SPMO;SEON:Domain Layer:SPMO:Tracked Process;Tracked Activity;;SPO:Performed Project Activity   ;;;2
DOMAIN;CPO;SEON:Domain Layer:CPO;Code Review Report;subkind;SysSwO:Document   ;Document pointing out problems identified in the Code during review activities.;;1
CORE;EO;SEON:Core Layer:EO:Organizational Structure;Complex Organizational Unit;;EO:Organizational Unit   ;;;1
FOUNDATIONAL;UFO;Foundational Layer:UFO:UFO-A;Moment;;UFO:Endurant   ;Moments are individuals that can only exist by inhering in other individuals. In other words, moments are individuals that are existentially-dependent on their bearers (@e.g., a person’s headache, a covalent bond between atoms).;;1
DOMAIN;RDPO;SEON:Domain Layer:RDPO;Requirements Evaluation Document;subkind;SysSwO:Document   ;Document pointing out problems identified in Documented Requirements and Conceptual Models registered in a Requirements Document.;;1
FOUNDATIONAL;UFO;Foundational Layer:UFO:UFO-C;Social Object;;UFO:Object   ;;;1
DOMAIN;CMPO;SEON:Domain Layer:CMPO;Change Implementer;role;SPO:Stakeholder   ;Stakeholder responsible for implementing a change in Configuration Items.;;1
DOMAIN;CMPO;SEON:Domain Layer:CMPO;Change Request (CR);subkind;SysSwO:Information Item   ;Information Item describing a request for modification on a set of Configuration Items.; a request for changing the project planning replacing a developer, which affects the Project Plan and the Project Schedule.;1
DOMAIN;RSMO;SEON:Domain Layer:RSMO:Software Measurement Process;Measures Identification;event;SPO:Performed Simple Activity   ;Activity for identifying and recording the Software-Related Measures to be included in the Software Measurement Plan. Software-Related Measures are identified from Information Needs in the sense that Measures must meet the identified Information Needs.;;2
DOMAIN;CMPO;SEON:Domain Layer:CMPO;Configuration Management Process;event;SPO:Performed Specific Process   ;Process for conducting the activities related to software configuration management, ensuring the completeness and correctness of software Configuration Items.;;5
FOUNDATIONAL;UFO;Foundational Layer:UFO:UFO-C;Plan Description;;UFO:Normative Description   ;;;1
CORE;EO;SEON:Core Layer:EO:Human Resource Management;Employment;relator;UFO:Social Relator   ;;;5
CORE;EO;SEON:Core Layer:EO:Human Resource Management;Human Resource;role;UFO:Role   UFO:Person   ;;;3
DOMAIN;QAPO;SEON:Domain Layer:QAPO;Noncompliance Identification;event;SPO:Performed Simple Activity   ;Activity for registering the noncompliances identified in processes and artifacts.;;2
DOMAIN;RRO;SEON:Domain Layer:RRO:Runtime Requirements;Adaptation Program;;RRO:RRT Program   ;An Adaptation Program is a RRT Program that intends to satisfy at least one Change Runtime Requirement Artifact.;;2
DOMAIN;HCIEO;HCI-ON:Domain Layer:HCIEO:Central View;HCI Evaluator Intention;;UFO:Intention   ;Intention that inheres in a HCI Evaluator, causing him to perform an HCI Evaluation.; the intention to evaluate an interactive computer system to find usability problems.;3
CORE;SysSwO;SEON:Core Layer:SysSwO:Sw Artifacts;System Specification;subkind;SysSwO:Document   ;;;2
DOMAIN;SDRO;SEON:Domain Layer:SDRO:Mental Aspects;Software Design Proposition;;UFO:Proposition   ;The propositional content of Software Designer Mental Moments.;;1
FOUNDATIONAL;UFO;Foundational Layer:UFO:UFO-C;Appointment Goal;;UFO:Goal   ;;;1
FOUNDATIONAL;UFO;Foundational Layer:UFO:UFO-A;Mixin Universal;;UFO:Substantial Universal   ;;;0
DOMAIN;HCIDO;HCI-ON:Domain Layer:HCIDO:Design Specification;HCI Design Proposition;;SDRO:Software Design Proposition   ;;;1
DOMAIN;CMPO;SEON:Domain Layer:CMPO;Configuration Audit Report;subkind;QAPO:Evaluation Report   SysSwO:Document   ;Document reporting the results of a Quality Audit Performing, including Noncompliance and Corrective Action Registers.;;2
CORE;HCIO;HCI-ON:Core Layer:HCIO:Interactive Computer System;Interactive Computer System;;SysSwO:Hardware Equipment   SysSwO:Computer System   COM:Measurable Entity   ;Computer System that combines User Interface, Computer Machine and Loaded Software System Copies, used to process, transform, store, display or transmit information or data by receiving input, and communicating output to Users.; a desktop computer, its monitor, keyboard, mouse and software systems loaded in the computer (operational system, browser, text editor, etc.), smart watch, smart mobile phone. ;9
CORE;HCIO;HCI-ON:Core Layer:HCIO:User;User Initiated Action;;HCIO:User Initiated Participation   HCIO:Intentional User Participation (User Action)   ;Intentional User Action of inputting data or information using an Input Equipment.; user touching her finger to unlock her mobile phone by using her fingerprint, user clicking the send button to send an email.;0
FOUNDATIONAL;UFO;Foundational Layer:UFO:UFO-C;Disposition;;;;;3
DOMAIN;RSMO;SEON:Domain Layer:RSMO:Software Measurement Process;Measurement Analyst;role;SPO:Stakeholder   ;Role played by the Stakeholder in charge of Software Measurement Analysis.; If John (a Person Stakeholder) was in charge of a software measurement analysis, then he played the role of measurement analyst.;1
CORE;COM;SEON:Core Layer:COM:Measurable Entities;Measurable Entity Type;;UFO:2ndOT   ;Type of entities that can be measured.; John is a measurable entity of the type Person.;4
CORE;SPO;SEON:Core Layer:SPO:Software Process Execution:Artifact Participation;Artifact Participation;event;UFO:Object Participation   ;The participation of an Artifact in a Performed Activity.; when an artifact is created, changed or used by an activity.;2
DOMAIN;RSMO;SEON:Domain Layer:RSMO:Software Measurement Process;Data Collection;event;;Activity for collecting and storing data for the Software-Related Measure indicated in the selected Software Measurement Plan Item. ;;2
CORE;SPO;SEON:Core Layer:SPO:Intended Software Process Definition:Intended Process Structure;General Intended Process;;SPO:Intended Process   ;Intended Process that is composed of Specific Intended Processes, allowing an Organization or Project to define sub-processes that are part of a complete Intended Process.; the overall Development Process defined for the Alpha Project.;2
CORE;COM;SEON:Core Layer:COM:Measure;Scale;;UFO:Measurement Reference Structure   ;Delimitates the space of values possible to be associated by a Measure to a Measurable Element.; the scale of the measure height in meters is a liner structure isomorphic to the positive half-line of the real numbers.;3
DOMAIN;GORO;SEON:Domain Layer:GORO;Hardgoal;;UFO:Goal   ;Hardgoal is a proposition that is objectively satisfied by a given set of situations.;;0
CORE;SPO;SEON:Core Layer:SPO:Software Process Execution:Performed Process;Performed Project Process;event;SPO:Performed Process   ;Performed Process executed within a Project.; a performed Requirement Process, a performed Construction Process.;2
CORE;SysSwO;SEON:Core Layer:SysSwO:Sw Artifacts;Software Item;kind;SysSwO:Software Artifact   UFO:Object   ;Piece of software, produced during the software process, not considered a complete Software Product, but an intermediary result.; a component, database schema, a script.;0
FOUNDATIONAL;UFO;Foundational Layer:UFO:UFO-A;Individual;;UFO:Entity   ;;;3
CORE;EO;SEON:Core Layer:EO:Human Resource Management;Human Resource Role;2ndOT;;;;0
CORE;SPO;SEON:Core Layer:SPO:Intended Software Process Definition:Intended Process Structure;Intended Activity;mode;RSMO:Measurable Software-Related Entity   UFO:Intention   ;Intention (Internal Commitment) representing the activity defined to be performed as part of an Intended Process, by a defined role, potentially consuming and producing artifacts, using resources and adopting procedures.; Unit Testing, Measure Collection, Strategic Goals Definition.;13
DOMAIN;ROoST;SEON:Domain Layer:ROoST:Testing Environment;Test Software Resource;role;SPO:Software Resource   ;Software Resource that comprises the Testing Environment of a Project.;;2
FOUNDATIONAL;UFO;Foundational Layer:UFO:UFO-C;Physical Object;;UFO:Object   ;;;0
DOMAIN;RDPO;SEON:Domain Layer:RDPO;Requirements Verification and Validation;event;SPO:Performed Composite Activity   ;Composite Performed Activity executed for evaluating Documented Requirements and Conceptual Models registered in Requirements Documents, and for recording the identified problems.;;7
CORE;SPO;SEON:Core Layer:SPO:Software Process Execution:Artifact Participation;Artifact Creation;event;SPO:Artifact Participation   UFO:Creation   ;Artifact Participation in which a new Artifact is created.; the creation of the source Code as part of a Coding activity.;0
CORE;EO;SEON:Core Layer:EO;Team Purpose;mode;UFO:Intention   ;;;1
FOUNDATIONAL;UFO;Foundational Layer:UFO:UFO-A;Universal;;UFO:Entity   ;;;6
CORE;COM;SEON:Core Layer:COM:Measurement Analysis;Measurement Analysis;;UFO:Event (Perdurant)   ;Action that analyzes Measure Values collected for Measures aiming to characterize a Measurable Entity and provide information related to a Measurement Goal.; a measurement analysis could analyze the measured values 26, 25.5 e 24, collected for the measure body mass index in kilos and meters to characterize the measurable entity John.    ;6
DOMAIN;CMPO;SEON:Domain Layer:CMPO;Solved CR;phase;CMPO:Change Request (CR)   ;Change Request solved through the Change Implementation.;;1
FOUNDATIONAL;UFO;Foundational Layer:UFO:UFO-A;Anti-Rigid Sortal Universal;;UFO:Sortal Universal   ;;;0
CORE;SysSwO;SEON:Core Layer:SysSwO:Sw Artifacts;Program Specification;subkind;SysSwO:Document   ;A document that describes the purpose (structure and functions) of a program in sufficient detail to permit coding and to facilitate maintenance.;;5
CORE;SysSwO;SEON:Core Layer:SysSwO:Sw Artifacts;Software System;subkind;SysSwO:Software Item   ;Software Item that aims at satisfying a specification (System Specification), concerning a desired change in a data structure inside a computer, abstracting away from the behavior.;;4
FOUNDATIONAL;UFO;Foundational Layer:UFO:UFO-C;Complex Closed Appointment;;UFO:Closed Appointment   UFO:Complex Closed Commitment   ;;;1
CORE;SPO;SEON:Core Layer:SPO:Software Process Execution:Stakeholder Participation;Stakeholder Participation;event;UFO:Action Contribution   ;The participation of a Stakeholder in a Performed Activity, playing an Organizational Role.; Mary acting as Programmer in a Coding Activity, the Quality Assurance Team acting as an Auditor in an Auditing activity.;4
CORE;HCIO;HCI-ON:Core Layer:HCIO:Interactive Computer System;Output Equipment;;SysSwO:Hardware Equipment   ;Hardware Equipment used to transmit or display information or data, communicating output to Users.; Monitor, speaker, etc. ;3
DOMAIN;DPO;SEON:Domain Layer:DPO;User Interface Specification;subkind;DPO:Interface Specification   ;Interface Specification focusing on the human-computer interaction.;;2
FOUNDATIONAL;UFO;Foundational Layer:UFO:MLT;2ndOT;;UFO:Entity   ;;;8
DOMAIN;HCIEO;HCI-ON:Domain Layer:HCIEO:Central View;HCI Evaluation Report;;SysSwO:Document   ;Document that presents evaluation results and other relevant information such as the considered HCI Evaluation Criteria.; Usability test report. ;4
DOMAIN;RSMO;SEON:Domain Layer:RSMO:Software Measurement Process;Measurement Executor;role;SPO:Stakeholder   ;Role played by the Stakeholder in charge of Software Measurement Execution. It does not include automated measurement (by tools).; If Mary (a Person Stakeholder) was in charge of a software measurement execution, then she played the role of measurement executor.;2
CORE;EO;SEON:Core Layer:EO:Human Resource Management;OU Assignment;relator;;;;4
DOMAIN;CMPO;SEON:Domain Layer:CMPO;Baseline Establishment;event;SPO:Performed Composite Activity   ;Activity for establishing a Baseline embracing a planned set of Configuration Items' Versions.;;5
DOMAIN;QAPO;SEON:Domain Layer:QAPO;Quality Assurance Process;event;SPO:Performed Specific Process   ;Process for conducting the activities related to software quality assurance, assessing and assuring adherence of the performed processes and produced artifacts to the applicable requirements.;;3
CORE;COM;SEON:Core Layer:COM:Measure;Measurement Formula;;UFO:Expression   ;Formula that quantifies relations between Measures from which a Derived Measure is obtained.; the measure body mass index in kilos and meters (BMI) can be calculated from the measures weight in kilos (w) and height in meters (h) by applying the measurement formula BMI = w/(h*h).;3
CORE;COM;SEON:Core Layer:COM:Measurement Planning;Measurement Goal;;UFO:Goal   ;Goal that can be used to drive the identification of the Measures needed to provide information in a certain context. Measurement Goals are established based on more general Goals.; in the context of a doctor’s office, a doctor could be the general goal of Taking a good care of the patients. From this general goal, could be established the measurement goal Monitor the patient health, which could be decomposed in others, such as Check if the patient has a good body mass index and Check if the patient has a good blood pressure.;6
DOMAIN;RSMO;SEON:Domain Layer:RSMO:Software Measurement Planning;Software Measurement Planning Item;subkind;SysSwO:Information Item   COM:Measurement Planning Item   ;Measurement Planning Item related to software. It is an Information Item produced during Software Measurement Planning and it is composed of a Software Measurement Goal Description, an Information Need Description, a Measure Description and an Operational Definition of Measure.; the software measurement planning item composed of the software measurement goal description Decrease defects in delivered products, the information need description What is the delivered defects density?, the measure description delivered defects density and an operational definition of measure established to the software-related measure delivered defects density.;10
FOUNDATIONAL;UFO;Foundational Layer:UFO:UFO-A;Endurant;;UFO:Concrete Particular   UFO:Individual   ;Endurants are said to be wholly present whenever they are present, i.e., they are in time. They can be understood in contrast with the category of Perdurants (Processes, Events). Examples of endurants are a house, a person, the Moon, an amount of sand. For instance, we can say that an individual John weights 80kg at in circumstance c1 but 68kg at in circumstance c2. Nonetheless, we are in these two cases referring to the same individual.;;3
FOUNDATIONAL;UFO;Foundational Layer:UFO:UFO-A:UFO-A Qualities;Measurement Reference Structure;;UFO:Reference Structure   ;Measurement Reference Structures act as scales based on quality structures. They are composed of Measurement Reference Regions. Measurement Reference Structures can be partitioned into spaces of the same magnitude according to a Unit.;;2
FOUNDATIONAL;UFO;Foundational Layer:UFO:UFO-C;Commitment;;;;;2
CORE;EO;SEON:Core Layer:EO;Organization;category;UFO:Social Agent   ;Same as UFO::Organization. A Social Agent involving people and other agents and facilities with an arrangement of responsibilities, authorities and relationships.; A company, an enterprise, a software house.;5
CORE;HCIO;HCI-ON:Core Layer:HCIO:User;Intentional User Participation (User Action);;HCIO:User Participation   UFO:Action Contribution   ;User participation intentionally performed.; user touching her finger to unlock her mobile phone by using her fingerprint, user clicking the send button to send an e-mail.;1
